<?xml version="1.0" encoding="UTF-8"?>
<?xml-stylesheet href="http://jmri.org/xml/XSLT/appearancetable.xsl" type="text/xsl"?>

<appearancetable
    xmlns:xsi = "http://www.w3.org/2001/XMLSchema-instance"
    xsi:noNamespaceSchemaLocation = "http://jmri.org/xml/schema/appearancetable.xsd"
>

  <copyright xmlns="http://docbook.org/ns/docbook">
    <year>2010</year><holder>JMRI</holder>
  </copyright>
  
  <authorgroup xmlns="http://docbook.org/ns/docbook">
    <author>
        <personname><firstname>Kevin</firstname><surname>Dickerson</surname></personname>

    </author>    
  </authorgroup>

  <revhistory xmlns="http://docbook.org/ns/docbook">
    <revision>
        <revnumber>1</revnumber>
        <date>2010-01-18</date>
        <authorinitials>KD</authorinitials>
        <revremark>Initial Version</revremark>
    </revision>    
  </revhistory>
  
  <aspecttable>BR</aspecttable>

  <name>4 Aspect Signal Head + Call On(individual aspects)</name>
  <reference></reference>
  <description>This uses 4 single state signal heads to represent the main signal and a further signal head to represent the Call-on</description>

  <name>Sample of full file format</name>
  <reference></reference>
  <description></description>
  
  <appearances>

    <appearance>
      <aspectname>Proceed</aspectname>
      <show>dark</show>
      <show>green</show>
      <show>dark</show>
      <show>dark</show>
      <show>dark</show>
      <reference></reference>
      <imagelink>../../../resources/icons/BritishRailSignals/cls4Proceed(wc).gif</imagelink>
    </appearance>

    <appearance>
      <aspectname>Caution</aspectname>
      <show>dark</show>
      <show>dark</show>
      <show>yellow</show>
      <show>dark</show>
      <show>dark</show>
      <reference></reference>
      <imagelink>../../../resources/icons/BritishRailSignals/cls4Caution(wc).gif</imagelink>
    </appearance>
    
    <appearance>
      <aspectname>Flash Caution</aspectname>
      <show>dark</show>
      <show>dark</show>
      <show>flashyellow</show>
      <show>dark</show>
      <show>dark</show>
      <reference></reference>
      <imagelink>../../../resources/icons/BritishRailSignals/cls4FlashCaution(wc).gif</imagelink>
    </appearance>
    
    <appearance>
      <aspectname>Preliminary Caution</aspectname>
      <show>yellow</show>
      <show>dark</show>
      <show>yellow</show>
      <show>dark</show>
      <show>dark</show>
      <reference></reference>
      <imagelink>../../../resources/icons/BritishRailSignals/cls4PriCaution(wc).gif</imagelink>
    </appearance>
    
    <appearance>
      <aspectname>Flash Preliminary Caution</aspectname>
      <show>flashyellow</show>
      <show>dark</show>
      <show>flashyellow</show>
      <show>dark</show>
      <show>dark</show>
      <reference></reference>
      <imagelink>../../../resources/icons/BritishRailSignals/cls4FlashPriCaution(wc).gif</imagelink>
    </appearance>
    
    <appearance>
      <aspectname>Danger</aspectname>
      <show>dark</show>
      <show>dark</show>
      <show>dark</show>
      <show>red</show>
      <show>dark</show>
      <reference></reference>
      <imagelink>../../../resources/icons/BritishRailSignals/cls4Danger(wc).gif</imagelink>
    </appearance>
    
    <appearance>
      <aspectname>Position Light Proceed at Caution (White/White)</aspectname>
      <show>dark</show>
      <show>dark</show>
      <show>dark</show>
      <show>red</show>
      <show>lunar</show>
      <reference></reference>
      <imagelink>../../../resources/icons/BritishRailSignals/cls4DangerCallOn.gif</imagelink>
    </appearance>

  </appearances>
</appearancetable>  